root@comp3134-winter-2024-intro-to-cybersecurity:~# tcpdump -n -i eth0
tcpdump: verbose output suppressed, use -v or -vv for full protocol decode
listening on eth0, link-type EN10MB (Ethernet), capture size 262144 bytes
18:42:15.208840 IP 159.203.39.243.22 > 198.96.85.106.63281: Flags [P.], seq 1557229110:1557229218, ack 1287845156, win 501, length 108
18:42:15.208915 IP 159.203.39.243.22 > 198.96.85.106.63281: Flags [P.], seq 108:144, ack 1, win 501, length 36
18:42:15.208969 IP 159.203.39.243.22 > 198.96.85.106.63281: Flags [P.], seq 144:252, ack 1, win 501, length 108
18:42:15.209013 IP 159.203.39.243.22 > 198.96.85.106.63281: Flags [P.], seq 252:288, ack 1, win 501, length 36
18:42:15.209155 IP 159.203.39.243.22 > 198.96.85.106.63281: Flags [P.], seq 288:460, ack 1, win 501, length 172
18:42:15.212348 IP 198.96.85.106.63281 > 159.203.39.243.22: Flags [.], ack 108, win 511, length 0
18:42:15.212348 IP 198.96.85.106.63281 > 159.203.39.243.22: Flags [.], ack 252, win 510, length 0
18:42:15.212348 IP 198.96.85.106.63281 > 159.203.39.243.22: Flags [.], ack 460, win 509, length 0
18:42:15.212385 IP 159.203.39.243.22 > 198.96.85.106.63281: Flags [P.], seq 460:1232, ack 1, win 501, length 772
18:42:15.212481 IP 159.203.39.243.22 > 198.96.85.106.63281: Flags [P.], seq 1232:1364, ack 1, win 501, length 132
18:42:15.212530 IP 159.203.39.243.22 > 198.96.85.106.63281: Flags [P.], seq 1364:1400, ack 1, win 501, length 36
18:42:15.212578 IP 159.203.39.243.22 > 198.96.85.106.63281: Flags [P.], seq 1400:1532, ack 1, win 501, length 132
18:42:15.212630 IP 159.203.39.243.22 > 198.96.85.106.63281: Flags [P.], seq 1532:1568, ack 1, win 501, length 36
18:42:15.212737 IP 159.203.39.243.22 > 198.96.85.106.63281: Flags [P.], seq 1568:1700, ack 1, win 501, length 132
18:42:15.212782 IP 159.203.39.243.22 > 198.96.85.106.63281: Flags [P.], seq 1700:1736, ack 1, win 501, length 36
18:42:15.231302 IP 198.96.85.106.63281 > 159.203.39.243.22: Flags [.], ack 1364, win 512, length 0
18:42:15.231302 IP 198.96.85.106.63281 > 159.203.39.243.22: Flags [.], ack 1532, win 512, length 0
18:42:15.231302 IP 198.96.85.106.63281 > 159.203.39.243.22: Flags [.], ack 1700, win 511, length 0
18:42:15.231369 IP 159.203.39.243.22 > 198.96.85.106.63281: Flags [P.], seq 1736:3024, ack 1, win 501, length 1288
18:42:15.231543 IP 159.203.39.243.22 > 198.96.85.106.63281: Flags [P.], seq 3024:3156, ack 1, win 501, length 132
18:42:15.231591 IP 159.203.39.243.22 > 198.96.85.106.63281: Flags [P.], seq 3156:3192, ack 1, win 501, length 36
18:42:15.231638 IP 159.203.39.243.22 > 198.96.85.106.63281: Flags [P.], seq 3192:3324, ack 1, win 501, length 132
18:42:15.231680 IP 159.203.39.243.22 > 198.96.85.106.63281: Flags [P.], seq 3324:3360, ack 1, win 501, length 36
18:42:15.236248 IP 198.96.85.106.63281 > 159.203.39.243.22: Flags [.], ack 2986, win 512, length 0
18:42:15.236249 IP 198.96.85.106.63281 > 159.203.39.243.22: Flags [.], ack 3156, win 512, length 0
18:42:15.236292 IP 159.203.39.243.22 > 198.96.85.106.63281: Flags [P.], seq 3360:4448, ack 1, win 501, length 1088
18:42:15.236416 IP 159.203.39.243.22 > 198.96.85.106.63281: Flags [P.], seq 4448:4580, ack 1, win 501, length 132
18:42:15.236466 IP 159.203.39.243.22 > 198.96.85.106.63281: Flags [P.], seq 4580:4616, ack 1, win 501, length 36
18:42:15.236511 IP 159.203.39.243.22 > 198.96.85.106.63281: Flags [P.], seq 4616:4748, ack 1, win 501, length 132
18:42:15.236855 IP 198.96.85.106.63281 > 159.203.39.243.22: Flags [.], ack 3324, win 511, length 0
18:42:15.236868 IP 159.203.39.243.22 > 198.96.85.106.63281: Flags [P.], seq 4748:5520, ack 1, win 501, length 772
18:42:15.236935 IP 159.203.39.243.22 > 198.96.85.106.63281: Flags [P.], seq 5520:5652, ack 1, win 501, length 132
18:42:15.239622 IP 198.96.85.106.63281 > 159.203.39.243.22: Flags [.], ack 4448, win 512, length 0
18:42:15.239622 IP 198.96.85.106.63281 > 159.203.39.243.22: Flags [.], ack 4616, win 512, length 0
18:42:15.239622 IP 198.96.85.106.63281 > 159.203.39.243.22: Flags [.], ack 5520, win 508, length 0
18:42:15.239644 IP 159.203.39.243.22 > 198.96.85.106.63281: Flags [P.], seq 5652:6056, ack 1, win 501, length 404
18:42:15.239728 IP 159.203.39.243.22 > 198.96.85.106.63281: Flags [P.], seq 6056:6188, ack 1, win 501, length 132
18:42:15.239769 IP 159.203.39.243.22 > 198.96.85.106.63281: Flags [P.], seq 6188:6224, ack 1, win 501, length 36
18:42:15.239812 IP 159.203.39.243.22 > 198.96.85.106.63281: Flags [P.], seq 6224:6356, ack 1, win 501, length 132
18:42:15.239846 IP 159.203.39.243.22 > 198.96.85.106.63281: Flags [P.], seq 6356:6392, ack 1, win 501, length 36
18:42:15.239886 IP 159.203.39.243.22 > 198.96.85.106.63281: Flags [P.], seq 6392:6524, ack 1, win 501, length 132
18:42:15.243421 IP 198.96.85.106.63281 > 159.203.39.243.22: Flags [.], ack 6056, win 512, length 0
18:42:15.243421 IP 198.96.85.106.63281 > 159.203.39.243.22: Flags [.], ack 6224, win 512, length 0
18:42:15.243421 IP 198.96.85.106.63281 > 159.203.39.243.22: Flags [.], ack 6392, win 511, length 0
